{
  "uci_manifest_version": "0.1",
  "node": {
    "node_id": "minimal_provider",
    "instance_id": "minimal_001",
    "display_name": "Minimal Provider",
    "node_type": "service",
    "version": "1.0.0"
  },
  "capabilities": [
    {
      "capability_id": "document_search",
      "version": "1.0",
      "category": "retrieval",
      "description": "Search indexed documents.",
      "actions": [
        {
          "action_id": "search_index",
          "execution": {"mode": "sync", "timeout_ms": 5000},
          "risk": {"level": "low"},
          "permissions": {"operator_confirmation": "none", "minimum_trust_state": "trusted"}
        }
      ]
    }
  ],
  "transports": [{"transport_id": "ipc_local", "type": "ipc", "endpoint": "uci://local/minimal"}],
  "governance": {"default_action_policy": "deny", "audit_required": true},
  "compliance": {"profile": "minimal"},
  "audit": {"audit_enabled": true},
  "extensions": {},
  "health": {}
}
